310,1406,"Z1改","レーベレヒト・マース",2,48,30512,174,179,70,300,350,0,0,0,0,1,33,59,38,40,11,45,25,70,15,45,15,45,36,36,69,97,97,41,41,79,112,112,8,8,42,71,71,12,49,10,1,6,3,0,0,0,0,0,78,-1,-1,-1,-1,24,1,1,6,0,1,1,0,0,"Guten Morgen.<br>僕の名前はレーベレヒト・マース。<br>レーベでいいよ…うん。","ドイツ生まれの駆逐艦、その本格的な大型駆逐艦の一<br>番艦だよ。<br>高温高圧缶や機関部のシフト配置など、技術の国なら<br>ではの設計になっているんだ。あまり外洋での艦隊戦<br>は得意じゃないけど…頑張るよ！",20,25,3,"vbuxfozqoemo",37,3,627
311,1407,"Z3改","マックス・シュルツ",2,48,30522,175,180,70,300,350,0,0,0,0,1,33,59,38,40,11,45,25,70,15,45,15,45,36,36,69,97,97,41,41,79,112,112,8,8,42,71,71,12,49,10,1,6,3,0,0,0,0,0,78,-1,-1,-1,-1,24,1,1,6,0,1,1,0,0,"Guten Tag.<br>私は駆逐艦マックス・シュルツよ。<br>マックス…でもいいけれど。よろしく。","ドイツ1934年計画型駆逐艦、その三番艦よ。<br>生存性の高い設計の本格的駆逐艦だけれど…新型のタ<br>ービンは少し整備に難もあるけれど。<br>今度は…大丈夫。",20,25,3,"vksfcnchqurh",21,1,627
312,1408,"浜風改","はまかぜ",2,30,16132,170,558,67,480,300,0,0,0,0,1,32,49,37,39,12,48,28,79,22,60,14,49,27,27,68,103,103,46,46,88,124,124,8,8,39,65,65,17,59,10,1,5,3,0,0,0,0,0,40,28,-1,-1,-1,24,1,2,10,0,1,1,1,1,"駆逐艦、浜風です。<br>これより貴艦隊所属となります。","浜風です。数々の激戦に参加しました。<br>レイテでは金剛を中心とした輪形陣。そして、武蔵や<br>金剛、あの信濃の最期もこの目に焼き付けることにな<br>りました。運命の坊ノ岬では、雪風らと共に大和を<br>護って奮闘します。",15,20,1,"ojkgkujsenly",82,29,627
313,1409,"谷風改","たにかぜ",2,30,16142,169,559,70,680,360,0,0,0,0,1,32,49,37,39,12,48,28,79,16,49,14,49,28,28,69,104,104,46,46,88,124,124,8,8,39,65,65,16,59,10,1,5,3,0,0,0,0,0,44,46,-1,-1,-1,24,1,2,10,0,1,1,1,1,"提督、谷風だよ。<br>これからお世話になるね！","谷風さんだよ。<br>あのミッドウェー海戦では、飛龍を助けようとしてた<br>ら、くそ敵機から雨あられの集中爆撃…。あんと<br>きゃ、まいったけど、勝見艦長がすげえんだ、マジ<br>で。",15,20,1,"jdyqtxzmsyng",65,17,627
314,1410,"酒匂改","さかわ",3,41,11042,140,0,0,0,0,0,0,0,0,1,46,62,52,54,27,67,23,78,19,74,31,69,29,31,85,131,133,41,42,81,114,115,14,14,59,98,98,30,74,10,2,6,3,2,2,2,0,0,-1,-1,-1,-1,-1,60,3,5,14,1,2,1,1,2,"ぴゃん♪　阿賀野型軽巡四番艦、酒匂です！<br>司令、よろしくね！","阿賀野型軽巡姉妹の末っ子、四番艦の酒匂だよ。<br>生まれるのが遅すぎたかな、あまりお外にはいけな<br>かった。矢矧ちゃんと一緒に行きたかったけど…舞鶴<br>でお留守番したの。",30,40,7,"kbdewgsfrkra",35,9,627
316,1411,"天津風改","あまつかぜ",2,30,16092,181,951,73,460,770,1,0,1,0,1,34,54,39,41,12,49,32,84,23,63,14,61,28,28,59,85,85,50,50,94,132,132,9,9,39,65,65,17,69,10,1,7,3,0,0,0,0,0,15,47,87,-1,-1,24,1,2,10,0,1,1,1,1,"いい風きてる？<br>次世代型駆逐艦のプロトタイプ、<br>あたし、天津風の出番ね。","陽炎型駆逐艦九番艦の天津風です。<br>次世代の艦隊型駆逐艦のための新型高温高圧缶のテス<br>トベッドを務めたのよ。データはしっかりとって、島<br>風に渡したわ。幾多のピンチも頑張って乗り越えたの<br>よ。大変だったんだから！",20,20,3,"cpcycglgelxd",55,5,627
317,1412,"浦風改","うらかぜ",2,30,16112,168,556,69,470,330,0,0,0,0,1,32,49,37,39,12,48,28,79,16,49,14,49,29,30,69,102,103,46,46,88,124,124,8,8,39,65,65,13,59,10,1,5,3,0,0,0,0,0,91,46,-1,-1,-1,24,1,2,10,0,1,1,1,1,"うち、浦風じゃ、よろしくね！","生まれは大阪、所属は呉。真珠湾からガダルカナルま<br>で駆けまわったんじゃ。<br>最期は金剛姉さんを護衛して台湾海峡…<br>まぁ、もうどうにもならんなぁ……。",15,20,1,"exedxncqauws",66,29,627
318,190,"龍鳳改","たいげい・りゅうほう",7,51,4032,185,883,80,1700,1900,1,1,0,0,2,48,70,54,56,0,32,0,0,28,62,24,57,0,0,0,0,0,30,30,62,89,89,30,30,74,112,112,24,79,5,1,6,4,21,9,9,6,0,21,82,51,-1,-1,160,4,8,24,5,0,0,2,2,"潜水母艦改装空母の龍鳳です。<br>航空母艦として、私、頑張ります！","潜水母艦改装空母の龍鳳です。<br>機関の換装の影響で速度は計画通りには出なかったけ<br>れど、このクラスの軽空母としては充実の飛行甲板と<br>兵装なんです。<br>空母龍鳳、精一杯頑張ります！",35,40,3,"rjtnzguullvo",82,4,627
319,191,"妙高改二","みょうこう",5,29,8056,265,0,0,0,0,0,0,0,0,2,56,71,63,65,50,82,36,88,28,80,47,80,0,0,0,0,0,47,47,88,123,123,19,19,61,97,97,32,80,10,2,6,4,2,2,4,4,0,90,90,28,-1,-1,80,4,7,20,2,3,1,2,2,"私、妙高型重巡洋艦、妙高と申します。<br>共に頑張りましょう。","ワシントン海軍軍縮条約下で建造された重巡洋艦で<br>す。<br>平賀譲氏設計による日本海軍の第一級の戦闘艦です。<br>現代の海上自衛隊のイージス艦にも、その名は受け継<br>がれています。",45,75,3,"kadfixosusrf",16,15,627
320,1413,"磯風改","いそかぜ",2,30,16122,167,557,68,480,300,0,0,0,0,1,33,49,38,40,12,48,28,79,24,64,14,49,27,27,68,103,103,47,47,88,123,123,9,9,49,83,83,18,81,10,1,6,3,0,0,0,0,0,91,44,106,-1,-1,24,1,2,10,0,1,1,1,1,"陽炎型駆逐艦十二番艦、磯風。<br>司令、共に進もう…心配はいらない。","陽炎型駆逐艦十二番艦、磯風だ。<br>戦歴ならあの雪風にも遅れはとらぬ。数々の海戦、決<br>戦に参加し、戦い抜いたんだ。大和・武蔵・金剛・大<br>鳳…彼女達の最期もこの目に焼き付いている。今度こ<br>そ…護り抜くさ。",15,20,3,"dyupugfxshtd",63,5,627
321,1414,"大淀改","おおよど",3,52,11052,183,0,0,0,0,0,0,0,0,1,47,64,53,55,32,71,0,49,22,77,32,69,0,0,39,72,72,40,40,78,111,111,28,28,84,132,132,30,84,10,2,7,4,0,6,6,0,0,65,107,106,-1,-1,80,4,3,14,3,2,0,2,2,"提督、旗艦大淀、お供いたします。<br>前線艦隊指揮はどうぞお任せください！","艦隊旗艦として特化設計された新鋭軽巡洋艦、大淀で<br>す。搭載予定の新型水偵の失敗や戦局の変化もあっ<br>て、連合艦隊旗艦としてはあまり活躍できなかった<br>の。でも、北号作戦や礼号作戦では活躍したのよ。私<br>も前線で、頑張りますね。",35,35,3,"gixbrtnuabge",90,15,627
322,1415,"時津風改","ときつかぜ",2,30,16102,186,0,0,0,0,0,0,0,0,1,32,49,37,39,12,48,28,79,16,49,14,49,26,26,64,97,97,46,46,88,124,124,8,8,39,65,65,12,59,10,1,6,3,0,0,0,0,0,15,91,-1,-1,-1,24,1,2,10,0,1,1,1,1,"陽炎型駆逐艦十番艦。<br>時津風……出るよ。","陽炎型十番艦の時津風だよ。<br>雪風、初風、天津風とで第十六駆逐隊を編成、仲良く<br>色々と頑張ったんだよ。二水戦にもいたんだよ、ほん<br>とほんと。でも、制海権の無い海は…ちょっと嫌かな<br>ーって。",15,20,3,"svglgiwjfyxn",14,14,627
323,1416,"春雨改","はるさめ",2,23,15112,405,975,78,190,390,0,0,1,0,1,30,49,35,37,12,49,28,79,15,49,14,49,24,24,59,89,89,45,45,89,127,127,7,7,39,66,66,12,59,10,1,5,3,0,0,0,0,0,63,75,-1,-1,-1,22,1,2,10,0,1,1,1,1,"白露型駆逐艦五番艦の春雨です、はい。<br>輸送作戦はお任せください……です。","白露型駆逐艦五番艦の春雨です。<br>おいしそう…ってその春雨とは違います！村雨や夕立<br>姉さんたちと共に第二駆逐隊として海を駆け巡りまし<br>た！輸送や護衛任務は、少し得意なんです。はい！",15,20,3,"cispmgxqaedk",64,13,627
324,1417,"早霜改","はやしも",2,38,16362,409,956,78,390,370,1,0,1,0,1,32,49,37,39,12,50,28,80,16,50,14,49,29,29,67,100,100,48,48,90,126,126,9,9,42,70,70,12,59,10,1,5,3,0,0,0,0,0,28,44,27,-1,-1,24,1,2,10,0,1,1,1,1,"また…来てしまったのね、この海に。<br>夕雲型駆逐艦、早霜…着任しました。","夕雲型駆逐艦、その十七番目、早霜です。<br>舞鶴海軍工廠生まれ。だいぶ押し迫った頃に生まれま<br>した。レイテ沖海戦にリンガ泊地から出撃して…色々<br>な光景を見ました。",15,20,3,"uvfgjekdjlcw",58,1,627
325,1418,"清霜改","きよしも",2,38,16382,410,955,78,390,370,1,0,1,0,1,32,49,37,39,12,51,28,80,16,50,14,49,29,29,67,100,100,48,48,90,126,126,9,9,42,70,70,13,59,10,1,5,3,0,0,0,0,0,28,47,27,-1,-1,24,1,2,10,0,1,1,1,1,"どうも！夕雲型の最終艦、清霜です。<br>到着遅れました、よろしくお願いです！","夕雲型駆逐艦のラスト、十九番艦の清霜です。<br>浦賀生まれですよ。もう、そうとう辛い戦局の中で生<br>まれたの。短い間だったけど、縦横無尽に活躍した<br>わ。凄惨だったレイテはもちろん、あの礼号作戦にも<br>参加したのよ！どう？",15,20,3,"xomrbwrvjwfv",60,3,627
326,204,"初春改二","はつはる",2,10,15016,238,0,0,0,0,0,0,0,0,2,31,52,36,38,13,55,32,90,23,73,14,51,30,30,69,102,102,48,48,90,126,126,10,10,45,75,75,16,59,10,1,6,3,0,0,0,0,0,63,106,40,-1,-1,20,1,2,10,0,1,2,1,1,"わらわが初春じゃ。<br>よろしく頼みますぞ。","初春型駆逐艦、１番艦の初春じゃ。<br>わらわは、北方部隊に所属。戦雲渦巻くアッツやキス<br>カなどの北方海域で活躍したぞ。<br>北海道周辺も好きな海域じゃな。マニラ湾やオルモッ<br>ク…？ああ、熱いところは苦手じゃ。",15,20,3,"xoiprnaxqxbj",15,18,627
327,1419,"朝雲改","あさぐも",2,18,15212,413,0,0,0,0,0,0,0,0,1,31,49,36,38,12,50,28,79,16,49,14,49,23,24,60,91,92,45,46,90,128,129,8,8,40,67,67,12,59,10,1,5,3,0,0,0,0,0,91,44,-1,-1,-1,22,1,2,10,0,1,1,1,1,"朝潮型駆逐艦、朝雲、着任したわ！<br>貴方が司令…かあ。ふうーん。ま、いいわ。私がやったげる！","朝潮型駆逐艦五番艦、朝雲よ。<br>盟友の山雲と一緒に、様々な戦場を駆け抜けたのよ。<br>そう、第九駆逐隊。有名でしょ？え、知らないって？<br>私、冗談ってあまり好きじゃないの。覚えておいて<br>よ！",15,20,3,"vdieczinfgce",55,15,627
328,1420,"山雲改","やまぐも",2,18,15222,414,0,0,0,0,0,0,0,0,1,31,49,36,38,12,49,28,80,16,50,14,48,27,27,65,98,98,46,46,89,126,126,8,8,40,67,67,11,58,10,1,5,3,0,0,0,0,0,91,44,-1,-1,-1,22,1,2,10,0,1,1,1,1,"おはようございます～。<br>朝潮型駆逐艦六番艦、山雲、入ります～。","朝潮型駆逐艦六番艦の山雲です～。<br>大阪生まれの横須賀育ちなの～。そうね、機雷とかは<br>注意しないといけないわね～。<br>護衛や哨戒で活躍、そしてマリアナ、西村艦隊の一員<br>としてレイテにも参加したわ～。",15,20,3,"pyfdxrfqwldn",51,9,627
329,1421,"野分改","のわき",2,30,16152,415,0,0,0,0,0,0,0,0,1,32,49,37,39,12,48,28,79,16,49,14,49,28,28,68,102,102,46,46,88,124,124,8,8,39,65,65,13,59,10,1,6,3,0,0,0,0,0,91,46,-1,-1,-1,24,1,2,10,0,1,1,1,1,"陽炎型駆逐艦、野分。参上しました。<br>さあ、司令。いきましょう。","陽炎型駆逐艦十五番艦、野分です。舞鶴生まれです。<br>舞風と一緒に第四駆逐隊に所属しました。<br>緒戦は那珂さん率いる四水戦と共に南方作戦、そして<br>ミッドウェー、マリアナ、レイテにも参加。できるこ<br>と…全力で頑張りました。",15,20,3,"qegrehgswrpg",27,15,627
330,1422,"秋月改","あきづき",2,54,17012,421,0,0,0,0,0,0,0,0,1,37,57,42,44,24,57,24,54,80,116,16,53,30,30,72,108,108,48,48,88,122,122,10,10,49,82,82,12,69,10,1,7,3,0,0,0,0,0,122,106,40,-1,-1,30,1,2,13,1,1,1,3,1,"秋月型防空駆逐艦、一番艦、秋月。<br>ここに推参致しました。お任せください！","艦隊防空のために建造された乙型一等駆逐艦、秋月型<br>駆逐艦一番艦、秋月です。<br>４基８門の長10cm砲と高射装置を備えた防空艦とし<br>て、僚艦の初月らと共に第61駆逐隊を編成しまし<br>た。頑張ります！",20,25,3,"tubwmcjwtlqx",29,11,627
331,202,"天城","あまぎ",11,53,3021,0,429,50,1000,750,1,0,0,0,0,48,79,54,56,0,25,0,0,27,72,26,51,0,0,0,0,0,33,33,59,81,81,38,38,74,105,105,13,59,10,1,6,4,18,24,3,6,0,40,10,-1,-1,-1,210,7,9,26,5,0,0,3,3,"雲龍型航空母艦、天城と申します。<br>提督、どうぞよろしくお願い致します。<br>天城、精進致します！","雲龍型航空母艦、その二番艦、天城です。戦時急造計<br>画であるマル急計画により、建造されました。<br>空母機動部隊として運用されることは叶いませんでし<br>たが、呉空襲時の対空戦で奮闘しました。",50,45,1,"gmlbignzjwmq",29,6,627
332,203,"葛城","かつらぎ",11,53,3031,0,430,50,1000,750,1,0,0,0,0,48,79,54,56,0,25,0,0,27,72,27,52,0,0,0,0,0,34,34,59,80,80,36,36,70,99,99,20,69,10,1,6,4,18,24,3,6,0,39,40,-1,-1,-1,210,7,9,26,5,0,0,3,3,"雲龍型航空母艦、三番艦、葛城よ！<br>え？　水上防空砲台ですって？<br>ち、違うわよ！　提督、何いってんの！","雲龍型航空母艦の三番艦、葛城よ。そう、正規空母。<br>ちょっと生まれるのが遅かったみたい。でも、戦いが<br>終わった後で、私は全力で働いたの。ある意味、私が<br>一番なんだから。ホントよ？ホントなんだから。",50,45,1,"fgyvwqymkekn",9,9,627
334,1504,"U-511改","ゆー511・ろ500",13,57,23012,431,436,55,270,170,0,0,0,0,1,13,18,17,18,3,12,27,64,0,0,6,20,0,0,0,0,0,20,20,59,92,92,9,9,29,46,46,34,67,5,1,6,2,0,0,0,0,0,-1,-1,-1,-1,-1,22,1,2,2,1,1,2,0,0,"ドイツ海軍所属、潜水艦U-511です。<br>ユーとお呼びください。<br>少し遠出してきました。よろしくお願い致します……。","ドイツ海軍のUボート、潜水艦U-511……です。<br>頑張って、ここまで来ました。<br>皆と仲良くなれたら…いいなって…ここの文化に馴染<br>めたらいいなって…思います。",10,20,1,"dfrmfmjvschh",29,5,627
343,1423,"香取改","かとり",21,56,12012,154,0,0,0,0,0,0,0,0,1,40,54,46,48,16,36,14,40,24,48,15,39,22,22,62,96,96,26,26,52,74,74,12,12,48,79,79,12,54,5,2,5,4,2,2,2,2,0,119,40,46,44,-1,70,3,2,11,1,1,1,2,1,"練習巡洋艦、香取です。<br>心配しないで…。色々と優しく、指導させて頂きますから。","香取型練習巡洋艦一番艦の香取です。<br>はい、練習遠洋航海の指揮は、お任せください。必ず<br>や艦隊の練度向上にお力添えできると思います。え、<br>戦艦との砲撃戦…ですか？それは用兵的にどうなので<br>しょうか。",35,20,3,"kexcbmpnmmwv",31,13,627
344,1424,"朝霜改","あさしも",2,38,16352,425,578,77,390,370,1,0,1,0,1,33,49,38,40,12,50,28,78,22,62,14,51,35,35,79,117,117,49,49,92,129,129,10,10,43,71,71,18,74,10,1,5,3,0,0,0,0,0,91,47,40,-1,-1,24,1,3,10,1,0,1,1,1,"よお！　夕雲型駆逐艦、十六番艦の朝霜、いつでも出撃できんぜ。<br>まだまだ、暴れよう…な、司令！","あたいは夕雲型駆逐艦、その十六番艦、朝霜さ。よー<br>く覚えとおくんだよ。<br>戦況が悪化した頃にデビューしたんだ。でも、その末<br>期の戦線を、文字通り縦横無尽に駆けまわったぜ。や<br>るだけ…やったさ！",15,20,3,"jozbiyweyksl",86,12,627
345,1425,"高波改","たかなみ",2,38,16252,424,649,79,390,370,1,0,1,0,1,32,49,37,39,12,51,28,80,16,50,14,49,29,29,67,100,100,48,48,90,126,126,13,13,54,89,89,10,57,10,1,5,3,0,0,0,0,0,129,28,27,-1,-1,24,1,2,10,0,1,1,1,1,"夕雲型駆逐艦、六番艦の高波です。<br>あ、あの…頑張ります！ホントかもです！","夕雲型駆逐艦６番艦、高波です。浦賀生まれです。<br>第三十一駆逐隊に編入され、活躍したかもです。運命<br>のルンガ沖夜戦でも警戒隊の旗艦として敵を発見…、<br>艦隊の勝利に貢献したかも…です。はい！",15,20,3,"ydsbnsiogwij",80,12,627
346,1426,"照月改","てるづき",2,54,17022,422,0,0,0,0,0,0,0,0,1,37,57,42,44,24,58,25,56,80,114,16,52,30,30,72,108,108,48,48,87,120,120,10,10,49,82,82,11,59,10,1,7,3,0,0,0,0,0,122,106,40,-1,-1,30,1,2,13,1,1,1,3,1,"秋月型防空駆逐艦、二番艦の照月よ。<br>戦艦の護衛でも、鼠輸送でも、なんでもこなしちゃうんだから！","秋月型防空駆逐艦二番艦、照月よ。<br>秋月姉と第61駆逐隊を編成しました。ソロモンの激<br>戦では、比叡さんや霧島さんと共に戦ったのよ！え？<br>ドラム缶による鼠輸送？ああ、あれは…あれはね…。",20,25,3,"urpnkwaneqfb",9,9,627
347,1427,"Libeccio改","リベッチオ",2,61,31532,443,0,0,0,0,0,0,0,0,1,29,46,33,35,11,48,27,72,20,59,15,50,40,40,80,114,114,50,50,92,128,128,10,10,46,77,77,16,69,10,1,7,3,0,0,0,0,0,147,147,-1,-1,-1,23,1,2,10,0,1,1,1,1,"ブォンジョールノ！<br>マエストラーレ級駆逐艦、リベッチオです。<br>リベでいいよ。提督さん、よろしくね！","イタリア海軍の駆逐艦、マエストラーレ級三番艦、リ<br>ベッチオです。提督さん、よろしくね！<br>え、タラント空襲？余裕です！船団護衛でも頑張りた<br>かったけど…救助中はやめてほしいよ～！",15,20,3,"rgfuelwdntub",82,10,627
348,1428,"瑞穂改","みずほ",16,62,6052,451,0,0,0,0,0,0,0,0,1,42,62,48,50,18,45,15,72,18,44,24,48,0,0,0,0,0,24,24,42,57,57,38,38,94,142,142,10,54,5,1,5,3,12,12,8,0,0,59,41,39,-1,-1,140,3,3,15,5,1,2,1,2,"提督、お疲れさまです。<br>水上機母艦、瑞穂、推参致しました。<br>どうぞよろしくお願い申し上げます。","水上機母艦、瑞穂です。千歳、千代田に続いて建造さ<br>れた、甲標的も運用可能な特殊水上機母艦です。新機<br>軸の機関部があまり上手くいかなくって……でも、開<br>戦初頭の南方作戦などに参加致しました。お役に立て<br>るよう頑張りますね！",40,45,3,"ycgllqsxwdgy",144,10,627
349,1429,"風雲改","かざぐも",2,38,16222,453,564,75,390,370,1,0,1,0,1,32,49,37,39,12,50,29,81,17,51,14,49,30,30,69,102,102,48,48,90,126,126,9,9,42,70,70,14,69,10,1,5,3,0,0,0,0,0,129,28,27,-1,-1,24,1,2,10,0,1,1,1,1,"夕雲型駆逐艦、三番艦の風雲よ。<br>そっか、貴方が提督なんだ。了解です。<br>ご命令、どうぞ！","艦隊型駆逐艦、夕雲型駆逐艦の三番艦、風雲よ、よろ<br>しく。<br>あのミッドウェーからソロモンまで、主戦場を駆けた<br>のよ。運命の日の夜、燃える空母を見上げたの。龍の<br>最期、忘れない。",15,20,3,"gykqxdkfpzih",102,14,627
350,1430,"海風改","うみかぜ",2,23,15132,458,587,82,390,360,0,0,1,0,1,30,48,35,37,12,49,28,79,16,50,14,49,27,27,63,94,94,46,46,89,126,126,8,8,40,67,67,13,64,10,1,4,3,0,0,0,0,0,63,44,-1,-1,-1,22,1,2,10,0,1,1,1,1,"白露型駆逐艦七番艦、<br>そして改白露型一番艦となる、海風です。<br>提督、どうぞよろしくお願いします！","白露型駆逐艦七番艦、改白露型としては一番艦となる<br>海風です。<br>マル２計画によって建造されました。第二水雷戦隊の<br>一翼として、ソロモン海の戦いにも参加しました。提<br>督、どうぞよろしくお願い致します。",15,20,3,"djszrxlnhbuv",80,13,627
351,1431,"江風改","かわかぜ",2,23,15152,459,469,75,390,300,0,0,0,0,1,30,48,35,37,12,49,29,80,15,49,14,49,24,24,59,89,89,46,46,89,126,126,8,8,40,67,67,12,59,10,1,5,3,0,0,0,0,0,63,28,-1,-1,-1,22,1,2,10,0,1,1,1,1,"白露型駆逐艦九番艦、<br>改白露型の江風だよ。よろしくな！<br>あ、読み方、間違えンなよ。","白露型九番艦、改白露型駆逐艦の江風だ。<br>そうさ、海風の姉貴たちと同じ、マル２計画で建造さ<br>れたよ。まー、働いた働いた。ソロモン海は何度も駆<br>け回ったよ。最期は夜戦さ。敵さんの電探…ありゃー<br>反則さ。",15,20,3,"litugbpkilsf",46,11,627
352,1432,"速吸改","はやすい",22,60,7112,460,0,0,0,0,0,0,0,0,1,48,50,50,50,8,36,0,0,20,48,6,19,12,12,36,56,56,10,10,33,52,52,18,18,59,94,94,8,44,5,1,7,3,6,3,1,0,0,18,146,40,-1,-1,220,8,1,20,1,1,1,2,1,"おはようございます！<br>航空機搭載給油艦、速吸、頑張ります！<br>艦載機も出撃用意、ばっちりです！","艦隊随伴型の給油艦、速吸です。よろしくお願いしま<br>す！<br>様々な物資を補給できる多用途給油艦でありながら、<br>航空機の運用が可能な設計です。ミッドウェー海戦後<br>の計画変更で流星の発進も可能となりました！",120,20,3,"niuenzxpukjq",23,30,627
353,1433,"Graf Zeppelin改","グラーフ・ツェッペリン",11,63,30112,432,0,0,0,0,0,0,0,0,1,78,92,86,88,15,52,0,0,44,80,42,81,0,0,0,0,0,29,29,69,103,103,45,46,75,100,101,7,48,10,2,7,4,30,13,10,3,0,159,64,160,-1,-1,270,10,17,36,8,2,0,4,4,"Guten Morgen!　私が航空母艦、Graf Zeppelin だ。<br>貴方がこの艦隊を預かる提督なのだな。そうか……了解だ。","Graf Zeppelin級航空母艦一番艦、Graf Zeppelin<br>だ。立体的な通商破壊戦を展開できる重武装の本格空<br>母だ。建造には日本の空母「赤城」の技術も参考にし<br>たらしい。日本の艦隊…か……楽しみだな。",70,80,3,"uljlkucfqqcc",9,8,627
354,1434,"嵐改","あらし",2,30,16162,454,0,0,0,0,0,0,0,0,1,32,49,37,39,12,49,28,79,16,49,14,49,30,30,70,104,104,46,46,87,122,122,8,8,39,65,65,12,63,10,1,6,3,0,0,0,0,0,91,45,-1,-1,-1,24,1,2,10,0,1,1,1,1,"や！　陽炎型駆逐艦、十六番艦、嵐だ！<br>司令、よろしくな！　逢えて嬉しいぜ！","陽炎型駆逐艦十六番艦、嵐だ。第四駆逐隊を編成し<br>て、四水戦で活躍したぜ。ミッドウェーでは、南雲機<br>動部隊の護りについたんだ。その後も最前線を縦横無<br>尽に駆け抜けて……最期の時は、暗い海での前線の輸<br>送作戦。僚艦の萩風と一緒さ。嵐、そして四駆の仲間<br>たち……覚えていてくれよな。頼むぜ。",15,20,3,"stvkbeqhwmmj",8,8,627
355,1435,"萩風改","はぎかぜ",2,30,16172,455,0,0,0,0,0,0,0,0,1,32,49,37,39,13,50,28,79,16,49,14,49,28,28,68,102,102,46,46,87,122,122,8,8,39,65,65,12,63,10,1,6,3,0,0,0,0,0,91,15,-1,-1,-1,24,1,2,10,0,1,1,1,1,"陽炎型駆逐艦、十七番艦、萩風。参りました。<br>司令、ご指示をお願いします。","陽炎型駆逐艦十七番艦、萩風です。浦賀生まれです。<br>嵐と一緒に第四駆逐隊で頑張りました。南雲機動部隊<br>の直衛、ソロモンの死闘を経験しました。最期の夜も<br>…嵐と一緒です。私たち、四駆のこと、覚えていてく<br>ださいね。",15,20,3,"vbqucvbohcex",8,8,627
356,1436,"鹿島改","かしま",21,56,12022,465,0,0,0,0,0,0,0,0,1,40,54,46,48,14,37,13,39,22,62,15,39,24,24,69,108,108,27,27,54,77,77,10,10,50,84,84,20,79,5,2,5,4,2,2,2,2,0,119,74,47,44,-1,70,3,2,11,1,1,1,2,1,"提督さん、お疲れさまです。<br>練習巡洋艦、鹿島、着任です。うふふ。","香取型練習巡洋艦二番艦、妹の鹿島です。平和の海<br>で、次代の艦隊を育てるために建造されました。その<br>本来の役目を果たせる時間はあまり長くはありません<br>でしたが、艦隊旗艦や船団護衛、精一杯頑張りまし<br>た。戦いが終わった後も、未来のために、私、頑張り<br>ました！　鹿島のこと、覚えていてくださいね。",35,20,3,"grgeljjshnfk",55,19,627
357,1437,"初月改","はつづき",2,54,17042,423,968,88,380,370,1,0,1,0,1,37,57,42,44,25,60,24,54,80,110,17,54,30,30,72,108,108,49,49,89,123,123,10,10,49,82,82,8,71,10,1,7,3,0,0,0,0,0,122,106,40,-1,-1,30,1,2,13,1,1,1,3,1,"秋月型駆逐艦、その四番艦、初月だ。<br>お前が提督か。いいだろう。僕が行こう。","秋月型防空駆逐艦、四番艦の初月だ。<br>舞鶴で生まれた。姉さんたちと共に、第六十一駆逐隊<br>を編成、マリアナ沖海戦や、レイテ沖海戦に参加し<br>た。防空戦闘、空母救援を実施した後、艦隊の殿とし<br>て僕は敵艦隊に向かった。",20,25,3,"wwuwxxrkzxex",53,3,627
358,1438,"Zara改","ザラ",5,64,31312,448,496,88,1500,1600,1,0,0,0,1,56,68,63,65,42,75,0,40,22,72,46,78,0,0,0,0,0,37,37,72,102,102,12,12,46,75,75,12,56,10,3,7,4,2,2,2,2,0,162,163,-1,-1,-1,70,4,6,18,3,4,0,1,2,"Buon Giornov！ ザラ級重巡、一番艦ザラです！<br>粘り強さが信条です。提督、よろしくね！","ザラ級重巡洋艦、その一番艦、ザラです。巡洋艦同士<br>の昼間水上砲戦なら、誰にも負けない自負はありま<br>す。妹のポーラが少し心配だけど、この艦隊なら！提<br>督、頑張りましょう！<br>重巡ザラ、艦隊に参加します！",45,65,3,"waviopoxryme",19,2,627
