598,398,"Honolulu","ホノルル",3,110,32421,0,711,45,400,480,0,0,0,0,0,38,56,43,45,29,59,0,34,26,70,16,39,0,0,35,65,65,32,32,66,95,95,17,17,65,106,106,15,70,10,2,5,3,0,1,3,0,0,386,-1,-1,-1,-1,70,3,3,13,2,2,0,2,2,"Aloha、提督！　あたしが、ニューヨーク生まれ、<br>ハワイ育ちのHonoluluだ！　あ～っノーザも居ンだ…！<br>そっか！いいね！　あたしの事も、よろしく頼むよっ！","あたし、Brooklyn級軽巡洋艦、Honolulu。ニュー<br>ヨーク生まれのハワイ育ち。よろしくねっ！戦いの始<br>まった日もあの真珠湾にいたんだ。ソロモンでは東京<br>急行を阻止するため、日本水雷戦隊のエースたちとガ<br>チでやりあったんだ。戦い抜いたよ！　覚えておいて<br>ね！",35,55,1,"nmjwixriholz",71,11,627
599,409,"赤城改二戊","あかぎ",11,14,2017,594,594,92,2000,2800,0,0,0,0,3,81,97,89,91,0,67,0,0,40,84,42,81,0,0,0,0,0,33,33,75,111,111,50,50,90,124,124,20,77,10,2,8,5,16,16,40,4,2,-1,-1,-1,-1,-1,270,13,17,40,15,0,0,6,5,"","航空母艦、赤城です。<br>空母機動部隊の主力として快進撃を支えます。<br>日頃鍛錬を積んだ自慢の艦載機との組み合わせは、無<br>敵艦隊とも言われたんです。慢心…ですって？<br>ううん、そうかなあ……気をつけますね。",95,85,1,"oepajmudatkf",64,1,627
600,400,"Houston改","ヒューストン",5,95,32312,595,0,0,0,0,0,0,0,0,1,54,67,61,63,46,76,20,60,30,75,40,73,0,0,0,0,0,36,36,76,110,110,16,16,53,85,85,20,65,10,2,7,4,1,1,1,4,0,356,358,-1,-1,-1,85,2,6,19,2,2,1,1,2,"","アジア艦隊に配備されたNorthampton級重巡、<br>Houstonよ。<br>Perth、De Ruyter…彼女達と共にABDA艦隊として<br>戦ったの。私の記憶はバタビア沖が最後だけど……<br>その魂と名は、新型軽巡に継承されたわ。",40,65,3,"nkkyfqvbrbli",86,1,627
601,401,"Colorado","コロラド",9,93,32011,0,1496,45,1600,2600,0,0,0,0,0,77,89,85,87,78,96,0,0,28,90,73,90,0,0,0,0,0,19,19,43,63,63,9,9,37,61,61,30,99,5,3,7,4,0,1,1,1,0,330,330,-1,-1,-1,300,10,21,39,3,5,0,1,4,"Hi! 私がステイツのBig7、Colorado級戦艦一番艦、<br>USS Coloradoよ！<br>貴方がAdmiral？ 悪くないわね。<br>私にしっかりついてきなさい！ 返事は？","私がステイツのBig7、Colorado級戦艦一番艦、USS <br>BB45 Coloradoよ。そう、ニューヨーク生まれ。太<br>平洋艦隊、真珠湾に配属されたわ。でも、本国で入渠<br>中に奇襲があって…まあ、いいわ。Big7の力、存分<br>に魅せてあげるわね！覚悟してて！",90,130,1,"cnghkhxvlmwk",51,1,627
602,402,"South Dakota","サウスダコタ",8,102,32061,0,697,48,2400,2700,0,0,0,0,0,79,92,87,89,81,100,0,0,40,91,77,93,0,0,0,0,0,28,28,59,85,85,15,15,48,76,76,20,79,10,3,7,4,0,0,3,3,0,381,381,-1,-1,-1,400,18,32,50,10,5,0,2,5,"Nice meeting you.<br>My name is South Dakota.　提督、よろしくな。","South Dakota class USS Battleship South Dakota<br>だ。高速空母機動部隊の護衛、南方ソロモンで水上艦<br>隊の殴り合いなど前線で活躍した戦艦だ。<br>Black Princeなどとも呼ばれたな。何？疫病神だと？<br>知らんな。",150,190,1,"kobflkooyivx",84,17,627
603,403,"Hornet","ホーネット",11,105,32161,0,704,40,2000,2800,0,0,0,0,0,67,84,74,76,0,45,0,0,32,72,38,65,0,0,0,0,0,30,30,57,80,80,45,45,70,91,91,28,67,10,2,7,4,36,18,18,15,0,197,195,195,196,-1,360,8,13,37,12,0,0,4,4,"そう、貴方が噂の提督なの。よろしくね。<br>私は USS CV8 Hornet!　I’m looking forward to you.","Yorktown 級航空母艦3番艦、USS Hornet よ。<br>ミッドウェー、そしてサンタ・クルーズ諸島沖で全盛<br>期の日本機動部隊と真正面から対決したわ。飛龍、そ<br>して翔鶴瑞鶴も強かった。シャングリラ伝説も私よ？<br>覚えておきなさい。",60,65,1,"hncspqqriwwj",54,1,627
604,399,"De Ruyter","デ・ロイテル",3,98,37411,0,609,50,400,360,0,0,0,0,0,28,43,32,34,21,50,0,50,20,70,15,31,10,10,40,66,66,35,35,68,96,96,10,10,42,69,69,9,49,10,2,4,3,1,1,2,0,0,360,-1,-1,-1,-1,60,3,4,12,1,1,0,1,2,"Hoi ！　貴方が噂のこの艦隊の提督ね！<br>私は、オランダ軽巡 De Ruyter！　 わかる？<br>わかるわかる？　そ、結構、いいから、私！　任せて。","オランダ生まれの軽巡洋艦、De Ruyterよ。<br>新型主砲と強力な対空機銃座を集中配備した新しいコ<br>ンセプトの軽巡として、当時のオランダ領東インドに<br>配備されたの。ABDA艦隊の旗艦として戦ったけど…<br>日本の重巡、あれはやばいわ…わかるわかる！",30,35,1,"kskvawgvqhmy",77,1,627
605,1505,"Luigi Torelli改","ルイージ・トレッリ",13,80,31712,535,539,40,300,160,0,0,0,0,1,13,23,17,19,0,8,0,32,0,22,5,18,0,0,0,0,0,18,18,56,89,89,8,8,28,45,45,30,72,5,1,5,2,0,0,0,0,0,-1,-1,-1,-1,-1,22,1,2,2,1,0,2,0,0,"","Regia Marinaから来たよ。パスタの国で生まれた潜<br>水艦、Luigi Torelli。通商破壊戦で、けっこー頑張っ<br>た。でも、そんだけじゃない、いろーんな事経験した<br>んだ。潜水艦派遣作戦にも参加してー、さらに色々<br>あってー、所属も何度も変わったよ。んー結構色々<br>あった感じ? あたしの物語も覚えておいてね。",10,15,3,"drbcfdxjgwgx",52,1,627
606,1506,"伊400改","い400",14,44,22112,493,0,0,0,0,0,0,0,0,1,24,39,28,30,6,20,40,82,0,0,7,24,0,0,0,0,0,12,12,43,69,69,16,16,46,72,72,19,58,5,1,7,2,3,3,0,0,0,62,-1,-1,-1,-1,200,1,2,4,3,0,2,1,1,"","潜特型、伊400型潜水艦、その一番艦、伊400です。<br>対艦船用戦術潜水艦ではなく、戦略運用のために建造<br>された、新コンセプトの潜水空母なんです。もちろん<br>艦載機は「晴嵐」さん。戦う前に矛を収めた私たち姉<br>妹、きっと覚えていてくださいね。",25,30,3,"dpcmmtepdfbn",51,2,627
607,1507,"伊47改","い47",13,103,22272,636,0,0,0,0,0,0,0,0,1,18,24,22,24,3,12,40,88,0,0,5,21,0,0,0,0,0,14,14,50,81,81,11,11,30,46,46,50,97,5,1,6,2,0,0,0,0,0,-1,-1,-1,-1,-1,22,1,2,2,2,0,3,0,0,"","佐世保生まれの伊号第四十七潜水艦、伊四十七です。<br>後期の主力潜水艦の例に漏れず、あの兵装を主力とし<br>て、ウルシー泊地襲撃やホーランディア、沖縄方面に<br>出撃、終戦まで戦いました。今は五島列島沖の海底で<br>眠っています。",10,25,3,"tciiyagxjjpu",112,1,627
609,1494,"De Ruyter改","デ・ロイテル",3,98,37412,604,0,0,0,0,0,0,0,0,1,43,60,49,51,29,70,0,60,25,75,29,67,15,15,50,80,80,39,39,73,102,102,11,12,55,92,93,10,57,10,2,5,3,1,2,2,0,0,361,-1,-1,-1,-1,60,3,5,13,1,1,0,1,2,"","オランダ生まれの軽巡洋艦、De Ruyterよ。<br>新型主砲と強力な対空機銃座を集中配備した新しいコ<br>ンセプトの軽巡として、当時のオランダ領東インドに<br>配備されたの。ABDA艦隊の旗艦として戦ったけど…<br>日本の重巡、あれはやばいわ…わかるわかる！",30,40,3,"yyvbmzcmbxuw",77,1,627
610,410,"加賀改二戊","かが",11,3,2027,698,646,84,1840,5700,0,0,0,0,3,84,98,92,94,0,62,0,0,36,84,41,80,0,0,9999,18685,18685,28,28,9999,18660,18660,0,9999,9999,9999,18685,18,74,10,2,8,5,18,18,40,8,2,-1,-1,-1,-1,-1,260,14,19,43,17,0,0,6,5,"","航空母艦、加賀です。八八艦隊三番艦戦艦として建造<br>されました。様々な運命のいたずらもあって、大型航<br>空母艦として完成、赤城さんと共に、栄光の第一航空<br>戦隊、その主力を担いました。<br>ここは、譲れません。",100,95,3,"hynqrgutrmmp",62,1,627
611,411,"御蔵","みくら",1,94,21011,0,616,45,175,90,0,0,0,0,0,9,18,13,15,4,17,0,0,9,36,4,16,40,40,78,111,111,40,40,80,114,114,3,3,14,23,23,12,59,5,1,4,2,0,0,0,0,0,382,39,-1,-1,-1,14,1,1,2,0,1,0,0,0,"御蔵型海防艦、一番艦、御蔵。着任します。<br>提督、御蔵型、何卒よろしくお願い致します。<br>体は小さいですが、力の限り、務めます。","御蔵型海防艦、一番艦、御蔵です。択捉型を改良、生<br>産性及び対空・対潜能力の向上を図りました。大きく<br>工数は下げられなかったものの、船団護衛戦闘力は向<br>上しています。あの択捉型の後継、御蔵型海防艦の<br>戦い、覚えていて下さい。",10,10,1,"qzvbtpknefns",61,1,627
612,412,"屋代","やしろ",1,94,21061,0,617,45,105,90,0,0,0,0,0,9,18,13,15,4,16,0,0,9,37,4,16,40,40,79,112,112,39,39,81,117,117,3,3,15,25,25,20,80,5,1,4,2,0,0,0,0,0,382,39,-1,-1,-1,14,1,1,2,0,1,0,0,0,"御蔵型海防艦、六番艦、屋代。参ります。<br>どんなに困難な状況でも、屋代、頑張り抜きます。<br>皆さんを護る、それが勤めですから。","御蔵型海防艦六番艦、屋代です。マル急計画で生まれ<br>ました。苦しいヒ船団の護衛や対潜掃蕩、戦後は機雷<br>掃海任務、そして、引渡し後は正安として、対馬と共<br>に戦いました。屋代、覚えていてください。",10,10,1,"kjofgeionllq",71,2,627
613,413,"Perth","パース",3,96,38411,0,618,45,380,400,0,0,0,0,0,29,44,33,35,24,58,20,54,24,66,17,32,15,15,50,80,80,33,33,67,96,96,9,9,40,66,66,12,55,10,2,4,3,1,1,1,0,0,359,-1,-1,-1,-1,60,3,4,12,1,1,1,1,2,"How are you?<br>私は、Perth級軽巡洋艦Perth。HMAS Perth！<br>イギリス生まれ、オーストラリア育ちよ。","Perth級軽巡洋艦Perth、英国生まれ、オーストラリ<br>ア育ちです。<br>連合軍ABDA艦隊の一翼として、南方作戦で南下する<br>日本艦隊を迎撃しました。重巡Houstonと共に最後<br>の一撃を図りましたが…。護る気持ちは…一緒です。",30,45,1,"jcixsqhnwjqb",72,1,627
614,414,"Grecale","グレカーレ",2,61,31521,0,619,35,290,180,0,0,0,0,0,15,30,19,21,9,26,22,57,10,40,7,18,30,30,60,86,86,47,47,84,116,116,7,7,20,31,31,14,90,10,1,6,2,0,0,0,0,0,147,-1,-1,-1,-1,23,1,1,6,0,1,1,0,0,"Buongiorno！<br>あたしがマエストラーレ級駆逐艦、次女のグレカーレ！<br>テートク、あたしも可愛がってよね？　あ、かーわいっ♪","イタリア海軍マエストラーレ級駆逐艦の次女、グレカ<br>ーレよ。なーに、あんまりジロジロみないでよ。姉妹<br>たちとの第10駆逐隊で結構頑張ったのよ。みんな、<br>逝ってしまったけれど、あたしは戦い抜けた。そし<br>て、戦いの後も海の護りについたの。主武装を撤去し<br>た司令艦として。覚えておいて。",15,20,1,"rfpvmivqupsf",91,3,627
615,415,"Helena","ヘレナ",3,106,32431,0,620,45,400,480,0,0,0,0,0,39,56,44,46,30,60,0,32,30,72,17,40,0,0,36,67,67,33,33,65,92,92,18,18,64,103,103,9,59,10,2,5,3,0,2,2,0,0,386,-1,-1,-1,-1,70,3,3,13,2,2,0,2,2,"My name is Helena.<br>St. Louis class 軽巡洋艦二番艦 USS CL50 Helena<br>よろしくね！","USS CL50 Helena です。<br>St. Louis class 軽巡２番艦として建造されました。<br>真珠湾空襲を経験、エスペランス岬沖海戦、第三次ソ<br>ロモン海戦、そしてクラ湾の夜戦で日本海軍の精鋭と<br>激しく戦いました。",35,55,1,"vpnkotekxrwk",73,1,627
616,416,"御蔵改","みくら",1,94,21012,611,0,0,0,0,0,0,0,0,1,17,28,21,23,5,37,0,0,16,60,7,33,40,40,84,122,122,54,54,89,119,119,5,5,29,49,49,15,64,5,1,5,3,0,0,0,0,0,382,226,346,-1,-1,14,1,1,2,0,1,0,1,0,"","御蔵型海防艦、一番艦、御蔵です。択捉型を改良、生<br>産性及び対空・対潜能力の向上を図りました。大きく<br>工数は下げられなかったものの、船団護衛戦闘力は向<br>上しています。あの択捉型の後継、御蔵型海防艦の<br>戦い、覚えていて下さい。",10,10,1,"etibrhysvhrt",61,1,627
617,417,"屋代改","やしろ",1,94,21062,612,0,0,0,0,0,0,0,0,1,17,28,21,23,5,36,0,0,16,62,7,33,39,39,85,124,124,53,53,90,122,122,0,5,30,51,56,30,98,5,1,5,3,0,0,0,0,0,-1,-1,-1,-1,-1,14,1,1,2,0,1,0,1,0,"","御蔵型海防艦六番艦、屋代です。マル急計画で生まれ<br>ました。苦しいヒ船団の護衛や対潜掃蕩、戦後は機雷<br>掃海任務、そして、引渡し後は正安として、対馬と共<br>に戦いました。屋代、覚えていてください。",10,10,1,"jcmwoyrbezdk",71,2,627
618,418,"Perth改","パース",3,96,38412,613,0,0,0,0,0,0,0,0,1,45,62,51,53,32,72,24,72,28,70,27,68,20,20,55,85,85,36,36,72,103,103,10,10,50,84,84,22,65,10,2,5,3,1,1,1,0,0,359,-1,-1,-1,-1,60,3,6,13,1,1,1,1,2,"","Perth級軽巡洋艦Perth、英国生まれ、オーストラリ<br>ア育ちです。<br>連合軍ABDA艦隊の一翼として、南方作戦で南下する<br>日本艦隊を迎撃しました。重巡Houstonと共に最後<br>の一撃を図りましたが…。護る気持ちは…一緒です。",30,45,3,"iewosubexfsp",72,1,627
619,419,"Grecale改","グレカーレ",2,61,31522,614,0,0,0,0,0,0,0,0,1,29,46,33,35,12,55,18,68,36,80,15,51,38,38,79,114,114,19,19,95,161,161,10,10,46,77,77,40,122,10,1,7,3,0,0,0,0,0,147,147,-1,-1,-1,23,1,2,10,0,1,1,1,1,"","イタリア海軍マエストラーレ級駆逐艦の次女、グレカ<br>ーレよ。なーに、あんまりジロジロみないでよ。姉妹<br>たちとの第10駆逐隊で結構頑張ったのよ。みんな、<br>逝ってしまったけれど、あたしは戦い抜けた。そし<br>て、戦いの後も海の護りについたの。主武装を撤去し<br>た司令艦として。覚えておいて。",15,20,3,"kombecutehdl",91,3,627
620,420,"Helena改","ヘレナ",3,106,32432,615,0,0,0,0,0,0,0,0,1,53,67,60,62,36,78,0,38,40,86,27,69,0,0,40,74,74,39,39,75,106,106,23,24,76,121,122,13,69,10,2,6,4,0,0,2,4,0,387,-1,-1,-1,-1,70,4,7,17,2,2,0,2,2,"","USS CL50 Helena です。<br>St. Louis class 軽巡２番艦として建造されました。<br>真珠湾空襲を経験、エスペランス岬沖海戦、第三次ソ<br>ロモン海戦、そしてクラ湾の夜戦で日本海軍の精鋭と<br>激しく戦いました。",35,60,3,"otpgrdspsxso",73,1,627
621,421,"神州丸","しんしゅうまる",17,97,25021,0,626,48,120,600,0,0,0,0,0,37,49,42,44,5,22,0,0,10,32,9,35,20,20,40,57,57,13,13,38,59,59,20,20,52,79,79,14,54,5,1,6,3,2,2,8,0,0,68,-1,-1,-1,-1,150,2,3,11,2,1,0,0,1,"陸軍特種船「神州丸」です。<br>統合的な上陸戦力を投射できる本格的な強襲揚陸艦の<br>先駆けとして建造されました。揚陸作戦はお任せください。","日本陸軍が建造した本格的な上陸用船艇母艦、現代で<br>いう強襲揚陸艦、その一番艦、神州丸です。完全武装<br>した陸戦部隊を載せた大発動艇などを満載、その泛水<br>装備で連続発進が可能です。緒戦の上陸戦、そして末<br>期の輸送作戦でも奮闘しました。提督殿、覚えていて<br>くださいね。",35,5,1,"dgnhxfrunaud",51,1,627
622,422,"夕張改二","ゆうばり",3,34,10176,293,623,86,180,630,0,0,0,0,2,41,55,47,49,14,56,50,80,58,88,35,65,49,49,83,112,112,40,40,83,120,120,10,13,52,85,88,30,88,10,1,7,5,0,0,0,0,0,-1,-1,-1,-1,-1,82,2,3,8,1,1,2,2,1,"","コンパクトボディに充実の重武装を施した実験艦的存<br>在の軽巡、夕張です。私の残したデータが、様々な重<br>武装新鋭艦開発の元になったんだから！<br>機関室に一発？何いってんの？<br>ほんと…失礼しちゃうわ。",30,40,3,"pwekirjjthqi",68,31,627
623,423,"夕張改二特","ゆうばり",3,34,10177,622,624,88,480,330,0,0,0,0,3,41,55,47,49,14,56,0,88,48,78,36,66,27,27,70,107,107,39,39,81,117,117,10,10,50,84,84,30,88,5,1,7,5,0,0,0,0,0,-1,-1,-1,-1,-1,82,2,3,8,1,1,2,2,1,"","コンパクトボディに充実の重武装を施した実験艦的存<br>在の軽巡、夕張です。私の残したデータが、様々な重<br>武装新鋭艦開発の元になったんだから！<br>機関室に一発？何いってんの？<br>ほんと…失礼しちゃうわ。",30,40,3,"tuzbqjvyptyt",68,31,627
624,424,"夕張改二丁","ゆうばり",3,34,10178,623,622,88,390,420,0,0,0,0,4,41,55,47,49,14,56,50,80,48,78,34,64,50,50,89,122,122,40,40,85,124,124,12,15,54,87,90,30,88,10,1,7,5,0,0,0,0,0,-1,-1,-1,-1,-1,82,2,3,8,1,1,2,2,1,"","コンパクトボディに充実の重武装を施した実験艦的存<br>在の軽巡、夕張です。私の残したデータが、様々な重<br>武装新鋭艦開発の元になったんだから！<br>機関室に一発？何いってんの？<br>ほんと…失礼しちゃうわ。",30,40,3,"ccjeljryazve",68,31,627
625,425,"秋霜","あきしも",2,38,16371,0,695,30,140,110,0,0,0,0,0,16,34,20,22,10,30,24,69,8,40,6,19,27,27,53,75,75,46,46,81,111,111,0,9999,20,-8648,37,11,49,10,1,4,2,0,0,0,0,0,2,39,-1,-1,-1,24,1,1,6,0,0,1,0,1,"うちが夕雲型駆逐艦、その十八番艦「秋霜」よ。<br>秋霜烈日、そんな言葉のような厳しい戦局を駆け抜けたの。<br>うちのことも覚えておいてね。忘れないでね。","夕雲型駆逐艦十八番艦「秋霜」よ。知っててくれた？<br>先輩方の二駆を継ぐ、夕雲型で編成された新編二駆を<br>「早霜」「清霜」と共に編成したの。大きな負け戦は<br>しっかり経験済み。最期は多号作戦。うちらのことも<br>…覚えていてね。",15,20,1,"fbxrcuyvvtot",69,1,627
626,426,"神州丸改","しんしゅうまる",17,97,25022,621,0,0,0,0,0,0,0,0,1,39,58,44,46,6,36,0,0,12,46,12,45,30,30,48,63,63,14,14,48,77,77,24,24,58,87,87,18,68,5,1,7,4,2,2,4,8,0,68,346,-1,-1,-1,150,2,3,12,3,1,0,1,1,"","日本陸軍が建造した本格的な上陸用船艇母艦、現代で<br>いう強襲揚陸艦、その一番艦、神州丸です。完全武装<br>した陸戦部隊を載せた大発動艇などを満載、その泛水<br>装備で連続発進が可能です。緒戦の上陸戦、そして末<br>期の輸送作戦でも奮闘しました。提督殿、覚えていて<br>くださいね。",40,20,3,"aslhofbqgbvf",51,1,627
627,427,"敷波改二","しきなみ",2,1,14126,208,0,0,0,0,0,0,0,0,2,31,53,36,38,13,61,28,88,16,62,14,51,30,30,79,121,121,58,58,93,123,123,11,11,48,80,80,30,80,10,1,6,3,0,0,0,0,0,63,44,46,-1,-1,22,1,2,10,0,2,2,1,1,"","特Ⅱ型駆逐艦２番艦の敷波。よろしく。<br>ミッドウェーやソロモンの海戦に参加した後、船団護<br>衛を務めたよ。<br>海上護衛戦は結構大変だよ…大事だし…。",15,20,1,"nkrohrcrhfkk",61,1,627
628,428,"Fletcher改 Mod.2","フレッチャー",2,91,32513,692,629,90,445,445,0,0,0,0,2,37,56,42,44,16,60,29,86,45,92,17,54,52,52,93,128,128,47,47,92,131,131,22,22,64,100,100,47,113,10,1,8,3,0,0,0,0,0,-1,-1,-1,-1,-1,23,1,2,12,4,1,1,3,1,"","最も成功し、量産された駆逐艦、そのネームシップ<br>が私、Fletcher class destroyer USS Fletcherです。<br>姉妹の数は170隻を超えているの。まさにデファクト<br>スタンダード。<br>後に海上自衛隊にも配備されました。",20,25,3,"jprihveusipc",76,2,627
629,429,"Fletcher Mk.II","フレッチャー",2,91,32516,628,628,90,445,445,0,0,0,0,3,38,57,43,45,16,62,0,82,50,95,17,56,55,55,97,133,133,47,47,94,134,134,23,23,66,103,103,47,113,10,1,8,3,0,0,0,0,0,-1,-1,-1,-1,-1,23,1,3,12,5,1,1,3,1,"","最も成功し、量産された駆逐艦、そのネームシップ<br>が私、Fletcher class destroyer USS Fletcherです。<br>姉妹の数は170隻を超えているの。まさにデファクト<br>スタンダード。<br>後に海上自衛隊にも配備されました。",25,25,3,"jhjyjljmfxma",76,2,627
630,430,"Gotland andra","ゴトランド",3,89,36416,579,0,0,0,0,0,0,0,0,2,47,67,53,55,16,60,16,73,30,90,22,67,36,36,60,80,80,37,37,78,113,113,46,46,72,94,94,26,108,10,2,8,4,2,2,3,7,0,303,173,304,304,-1,60,2,4,11,3,1,1,3,1,"","スウェーデン生まれの航空巡洋艦、ゴトランドです。<br>皆さん、よろしくお願いしますね。<br>軽巡クラスなんです、私！　だから、あまり搭載機も<br>多くはないし、カタパルトも一基。…予算がね。うう<br>ん、いいの！　艤装は最高よ。現代にも繋がる我がス<br>ウェーデンの兵装技術、ね、覚えてて。",30,35,3,"kgykxxmonxbh",119,4,627
631,431,"薄雲","うすぐも",2,12,14071,0,700,40,190,130,0,0,0,0,0,15,29,19,21,10,29,27,69,10,39,5,19,19,19,49,75,75,39,39,80,115,115,4,4,19,32,32,7,49,10,1,4,2,0,0,0,0,0,297,-1,-1,-1,-1,20,1,1,5,0,0,1,0,0,"特I型駆逐艦、七番艦、薄雲です。東京湾の造船所で<br>生まれ、あの戦いでは北方の海で活動しました。<br>提督、薄雲のこと、覚えていてくださいね。","特I型駆逐艦、七番艦、薄雲です。東京湾の造船所で<br>生まれ、第五艦隊で北方海域、千島列島やアッツ、キ<br>スカでの作戦に従事しました。最後の任務も北方のキ<br>５０４船団。提督、薄雲のこと、忘れないでいてくだ<br>さいね。",15,20,1,"ntjerkmvkups",55,1,627
632,432,"有明","ありあけ",2,10,15051,0,703,48,100,290,0,0,0,0,0,16,31,20,22,10,29,27,70,8,38,6,19,21,21,50,75,75,43,43,80,112,112,5,5,19,31,31,10,49,10,1,4,2,0,0,0,0,0,2,-1,-1,-1,-1,20,1,1,5,0,0,1,0,0,"よお！ 有明だ。元気してるかい、提督？　そうか！<br>いい感じだな！　今日もあたしと行くだろう？<br>夕暮、露、時雨、準備はいいか？ 二十七駆、抜錨だ！","あたしが初春型駆逐艦五番艦、有明さ。有明型って呼<br>んでくれたって、あたしは全然構わないよ。南方を中<br>心に数々の戦域を駆け抜けたぜ。な？覚えておいてく<br>れよ？新しい時代の護衛艦にこの名は受け継がれ、現<br>代の海自むらさめ型としても活躍しているんだ。",15,20,1,"iocnvrthfxrw",53,12,627
633,433,"夕暮","ゆうぐれ",2,10,15061,0,725,49,120,290,0,0,0,0,0,16,31,20,22,10,29,27,71,8,37,6,19,21,21,50,75,75,43,43,79,110,110,5,5,20,33,33,10,48,10,1,4,2,0,0,0,0,0,2,-1,-1,-1,-1,20,1,1,5,0,0,1,0,0,"ごきげんよう。初春型の夕暮、と申します。<br>有明型の二番艦、という殿方もいますわ。有明同様、<br>わたくしの事も、どうぞ、可愛がってくださいまし。","初春型駆逐艦六番艦、夕暮です。わたくしも有明型…<br>と呼んでくださっても、ええ、構いません。緒戦の太<br>平洋を皆さんと駆け、ソロモンの夜も、共に戦いまし<br>た。最期の夜も、ソロモンの夜。満月が、とても綺麗<br>でした。有明と共に、海上自衛隊最初期の護衛艦に、<br>その名は継承されました。",15,20,1,"nxvfncdgyiwv",51,3,627
634,434,"迅鯨","じんげい",20,100,7011,0,639,45,480,500,0,0,0,0,0,32,48,37,39,6,32,0,0,12,32,5,28,0,0,0,0,0,13,13,28,41,41,20,20,38,53,53,11,50,5,2,4,2,1,1,0,0,0,119,-1,-1,-1,-1,150,2,2,11,1,1,0,1,1,"私、迅鯨型潜水母艦一番艦、迅鯨と申します。<br>提督、貴方に会えて……良かった。<br>一緒に頑張っていきましょう！","迅鯨型潜水母艦一番艦、迅鯨です。八八艦隊計画の流<br>れの中で生まれました。潜水戦隊の旗艦としてはもち<br>ろん、練習艦や輸送任務でも活躍しました。日本初の<br>本格的な設計の潜水母艦、妹の長鯨共々、どうぞよろ<br>しくお願いします。",30,10,1,"ugieenlacpcu",114,32,627
635,435,"長鯨","ちょうげい",20,100,7021,0,640,47,480,500,0,0,0,0,0,31,49,36,38,6,31,0,0,11,33,5,28,0,0,0,0,0,12,12,30,45,45,20,20,37,51,51,17,77,5,2,4,2,1,1,0,0,0,119,-1,-1,-1,-1,150,2,2,11,1,1,0,1,1,"提督、迅鯨型潜水母艦二番艦、長鯨です！<br>いつも姉が大変お世話になっています！<br>はいっ！　潜水艦のお世話はあたしにお任せですよ？","迅鯨型潜水母艦の二番艦、長鯨。<br>迅鯨姉さんの妹です。少しだけ旧式ですが、最新潜水<br>母艦が空母に改装されたので、最前線の潜水母艦に再<br>配備されました！潜水母艦として、さらに輸送任務や<br>対空戦闘、戦いが終わった後も大切なお仕事、頑張り<br>ました！姉さん共々、忘れないでね。",30,10,1,"xnelpbkqncck",87,18,627
636,436,"伊47","い47",13,103,22271,0,607,50,290,170,0,0,0,0,0,14,19,18,19,2,8,36,72,0,0,4,20,0,0,0,0,0,13,13,39,61,61,7,7,27,44,44,47,90,5,1,5,1,0,0,0,0,0,-1,-1,-1,-1,-1,22,1,3,2,0,0,2,0,0,"伊号潜水艦、巡潜丙型の七番艦、伊四十七。<br>ヨナって、呼んでくださいな。　ヨナですよ？<br>うふふ、提督、いいですか？","佐世保生まれの伊号第四十七潜水艦、伊四十七です。<br>後期の主力潜水艦の例に漏れず、あの兵装を主力とし<br>て、ウルシー泊地襲撃やホーランディア、沖縄方面に<br>出撃、終戦まで戦いました。今は五島列島沖の海底で<br>眠っています。",10,20,1,"fkctbjiyyefn",111,1,627
